{
  "schemaVersion": 1,
  "shardId": "vf-shard-2bc59ebc4ff1490018f0",
  "path": "synthetic_data/shards/v1/firmware.jsonl",
  "recordFormat": "vf-task-record-jsonl-v1",
  "recordCount": 44,
  "sizeBytes": 207010,
  "sha256": "2bc59ebc4ff1490018f0fae34eea230ab47deb6c1ed382f5b005fea3419e488c",
  "status": "approved",
  "eligibleUses": [
    "training"
  ],
  "reason": null,
  "createdAtUtc": "2026-09-01T11:33:13.078321+00:00",
  "sourceRegistry": {
    "registryId": "voltforge-source-registry",
    "version": "1.2.0",
    "sha256": "d775e5c2c633fee61ed4553058ad356a83f9298388bb8b5b48cd4880fcadb506"
  },
  "sources": [
    {
      "sourceId": "vf-src-curated-electronics-corpus-v1",
      "revision": "1.1.0",
      "checksum": "5a3080d1f22b927942492a19296405553a050b8daf5458234eac603be1343089",
      "licenseStatus": "approved",
      "privacyClass": "project-authored-non-user-data",
      "approvalStatus": "approved"
    },
    {
      "sourceId": "vf-src-verified-synthetic-pipeline-v1",
      "revision": "1.3.0",
      "checksum": "b25c61e7c5210af35e86df3b9d9c0519b18a583aacdea91a763b1d3ae2c15abd",
      "licenseStatus": "approved",
      "privacyClass": "project-authored-non-user-data",
      "approvalStatus": "approved"
    }
  ],
  "producer": {
    "id": "vf-verified-synthetic-pipeline-v1",
    "version": "1.3.0",
    "path": "synthetic_data/pipeline-lock.v1.json",
    "sha256": "b25c61e7c5210af35e86df3b9d9c0519b18a583aacdea91a763b1d3ae2c15abd"
  },
  "preprocessing": {
    "id": "vf-held-out-exclusion",
    "version": "1.0.0",
    "path": "evaluation/leakage.py",
    "sha256": "09615b4bdd79f0da39253a3db4f03f650e15195686bd3c73ec03ede8b1ae7754"
  },
  "taskSchema": {
    "id": "voltforge-task-record",
    "version": "1.0.0",
    "path": "task_schema/task-record.schema.json",
    "sha256": "a22d38d4bdd83d6bacee896d62c46547032daa9381c0c420646988f5dc2fd0fd"
  },
  "recordProvenance": {
    "mode": "shard-inherited",
    "selector": "all-records",
    "sourceIds": [
      "vf-src-curated-electronics-corpus-v1",
      "vf-src-verified-synthetic-pipeline-v1"
    ],
    "statement": "Every non-empty record in this shard inherits this immutable source and producer snapshot."
  },
  "retention": {
    "sourcePolicies": [
      {
        "sourceId": "vf-src-curated-electronics-corpus-v1",
        "policy": {
          "class": "project-curated-source",
          "duration": "while referenced by an approved shard, runtime index, or model artifact",
          "reviewTrigger": "manufacturer revision, evidence conflict, corpus contract change, or source removal request"
        },
        "deletionProcedure": "Run tools/source_removal_impact.py for this source, remove or deactivate dependent task shards, retrieval indexes, and model artifacts, delete generated packs/catalog/report, then rebuild and repeat release gates."
      },
      {
        "sourceId": "vf-src-verified-synthetic-pipeline-v1",
        "policy": {
          "class": "project-verified-training-source",
          "duration": "while referenced by an approved shard or model artifact",
          "reviewTrigger": "grammar, verifier, compiler, corpus, task schema, leakage gate, or source-policy revision"
        },
        "deletionProcedure": "Run tools/source_removal_impact.py for this source, deactivate and remove dependent shards and model artifacts, remove compile receipts and reports, then regenerate, retrain, and repeat release gates."
      }
    ]
  },
  "manifestSha256": "e2f2bd040d2f21e3d01ce0c453415075b2bbf9659322837173e1bd9d53973a34"
}
