{
  "schemaVersion": 1,
  "shardId": "vf-shard-52ccd02a1d8d5120bd84",
  "path": "model/artifacts/master_domain_dataset.jsonl",
  "recordFormat": "jsonl-v0",
  "recordCount": 2219,
  "sizeBytes": 1313789,
  "sha256": "52ccd02a1d8d5120bd84b33c7887c61761a9ed6850a1926a3214e1b1b0a15113",
  "status": "quarantined",
  "eligibleUses": [],
  "reason": "The retained aggregate predates immutable run, generator, preprocessing, and source snapshots.",
  "createdAtUtc": "2026-09-01T11:41:37.877229+00:00",
  "sourceRegistry": {
    "registryId": "voltforge-source-registry",
    "version": "1.2.0",
    "sha256": "d775e5c2c633fee61ed4553058ad356a83f9298388bb8b5b48cd4880fcadb506"
  },
  "sources": [
    {
      "sourceId": "vf-src-project-domain-generator-v1",
      "revision": "2.0.0",
      "checksum": "233e8157019ec3bafdc4e130470c7c38369582ce20834526e4157e5e828a1293",
      "licenseStatus": "approved",
      "privacyClass": "project-authored-non-user-data",
      "approvalStatus": "approved"
    }
  ],
  "producer": {
    "id": "vf-domain-corpus-generator",
    "version": "pre-governance",
    "path": "model/generate_domain_corpus.py",
    "sha256": "233e8157019ec3bafdc4e130470c7c38369582ce20834526e4157e5e828a1293"
  },
  "preprocessing": {
    "id": "unknown-pre-governance-process",
    "version": "unknown",
    "path": null,
    "sha256": null
  },
  "taskSchema": {
    "id": "legacy-untyped",
    "version": "0",
    "path": null,
    "sha256": null
  },
  "recordProvenance": {
    "mode": "shard-inherited",
    "selector": "all-records",
    "sourceIds": [
      "vf-src-project-domain-generator-v1"
    ],
    "statement": "Every non-empty record in this shard inherits this immutable source and producer snapshot."
  },
  "retention": {
    "sourcePolicies": [
      {
        "sourceId": "vf-src-project-domain-generator-v1",
        "policy": {
          "class": "project-source",
          "duration": "while referenced by an approved shard or artifact",
          "reviewTrigger": "source revision or policy change"
        },
        "deletionProcedure": "Run tools/source_removal_impact.py for this source, deactivate affected approved artifacts, delete affected shards and manifests, then retrain and repeat release gates."
      }
    ]
  },
  "manifestSha256": "1c772b6ce5ebdf7f19eb95d0d9d416e75b1a0632cfb0d7ef93cbcf44fa42837d"
}
