{
  "schemaVersion": 1,
  "shardId": "vf-shard-db5b42f71e3fc74b7ba2",
  "path": "dataset.txt",
  "recordFormat": "qa-text-v0",
  "recordCount": 362,
  "sizeBytes": 85787,
  "sha256": "db5b42f71e3fc74b7ba2514997865b2f653eb9c8623eb5ddb0bd8222577d1802",
  "status": "quarantined",
  "eligibleUses": [],
  "reason": "Origin and license evidence are missing; direct training and runtime retrieval are denied.",
  "createdAtUtc": "2026-09-01T11:41:37.744130+00:00",
  "sourceRegistry": {
    "registryId": "voltforge-source-registry",
    "version": "1.2.0",
    "sha256": "d775e5c2c633fee61ed4553058ad356a83f9298388bb8b5b48cd4880fcadb506"
  },
  "sources": [
    {
      "sourceId": "vf-src-legacy-dataset-txt-v0",
      "revision": "legacy-snapshot-2026-08-13",
      "checksum": "db5b42f71e3fc74b7ba2514997865b2f653eb9c8623eb5ddb0bd8222577d1802",
      "licenseStatus": "unverified",
      "privacyClass": "unknown-origin-no-observed-user-identifiers",
      "approvalStatus": "quarantined"
    }
  ],
  "producer": {
    "id": "unknown-legacy-authoring",
    "version": "unknown",
    "path": null,
    "sha256": null
  },
  "preprocessing": {
    "id": "unknown-legacy-process",
    "version": "unknown",
    "path": null,
    "sha256": null
  },
  "taskSchema": {
    "id": "legacy-untyped",
    "version": "0",
    "path": null,
    "sha256": null
  },
  "recordProvenance": {
    "mode": "shard-inherited",
    "selector": "all-records",
    "sourceIds": [
      "vf-src-legacy-dataset-txt-v0"
    ],
    "statement": "Every non-empty record in this shard inherits this immutable source and producer snapshot."
  },
  "retention": {
    "sourcePolicies": [
      {
        "sourceId": "vf-src-legacy-dataset-txt-v0",
        "policy": {
          "class": "quarantined-audit-evidence",
          "duration": "until owner review or deletion",
          "reviewTrigger": "license and origin evidence becomes available"
        },
        "deletionProcedure": "Run tools/source_removal_impact.py for this source, delete dataset.txt and every listed dependent shard/manifest, retain the impact report, and retrain any affected approved artifact."
      }
    ]
  },
  "manifestSha256": "bd0e344114a8faff0818a997071116e9c33f287c1af4f4c25e3f91997c0f3e71"
}
