{
  "schemaVersion": 1,
  "shardId": "vf-shard-f9a4a9c795baa288ef4f",
  "path": "model/artifacts/dataset_1b.jsonl",
  "recordFormat": "jsonl-v0",
  "recordCount": 2500,
  "sizeBytes": 2348878,
  "sha256": "f9a4a9c795baa288ef4fce8c4193ca19cff1b885c05a7a93bbc675d62c051013",
  "status": "quarantined",
  "eligibleUses": [],
  "reason": "The generator is retired and its retained output has no approved immutable run lineage.",
  "createdAtUtc": "2026-08-31T07:34:05.100481+00:00",
  "sourceRegistry": {
    "registryId": "voltforge-source-registry",
    "version": "1.2.0",
    "sha256": "66d939d62f0909ae7a21aaecd6a84078ea597e69e0ef8183c40d4b35ec902786"
  },
  "sources": [
    {
      "sourceId": "vf-src-retired-scale-generator-v0",
      "revision": "retired-v0",
      "checksum": "a48eb1605a9da458dad5306063dcea259fd7f5fee6bfc1dcef4d2452e47a9a0e",
      "licenseStatus": "unverified",
      "privacyClass": "legacy-synthetic-unknown-lineage",
      "approvalStatus": "retired"
    }
  ],
  "producer": {
    "id": "retired-scale-experiment-generator",
    "version": "retired-v0",
    "path": "model/legacy/retired_scale_experiment/dataset_generator.py",
    "sha256": "a48eb1605a9da458dad5306063dcea259fd7f5fee6bfc1dcef4d2452e47a9a0e"
  },
  "preprocessing": {
    "id": "unknown-legacy-process",
    "version": "unknown",
    "path": null,
    "sha256": null
  },
  "taskSchema": {
    "id": "legacy-untyped",
    "version": "0",
    "path": null,
    "sha256": null
  },
  "recordProvenance": {
    "mode": "shard-inherited",
    "selector": "all-records",
    "sourceIds": [
      "vf-src-retired-scale-generator-v0"
    ],
    "statement": "Every non-empty record in this shard inherits this immutable source and producer snapshot."
  },
  "retention": {
    "sourcePolicies": [
      {
        "sourceId": "vf-src-retired-scale-generator-v0",
        "policy": {
          "class": "retired-audit-evidence",
          "duration": "until explicit cleanup approval",
          "reviewTrigger": "legacy artifact cleanup"
        },
        "deletionProcedure": "Run the source impact analyzer, delete dataset_1b.jsonl and its manifest, and keep the retired label record or deletion audit."
      }
    ]
  },
  "manifestSha256": "9599e299edace891877d39111484acec7c61fb893a25e5abd474a449e7021371"
}
